{
  "id": "my-application",
  "name": "My Application",
  "version": "1.1.1",
  "properties": {
    "anypoint.platform.client_id": {
      "id": "anypoint.platform.client_id",
      "name": "Anypoint platform client id",
      "secure": false
    },
    "anypoint.platform.client_secret": {
      "id": "anypoint.platform.client_secret",
      "name": "Anypoint platform client secret",
      "secure": true
    }
  }
}
